name,location,price,site
"Ração Para Cães Adultos Pedigree Carne, Frango E Cereais 10,1kg",Cobasi,"R$ 167,90",https://www.cobasi.com.br/racao-pedigree-carne-e-frango-e-cereais-3634565/p?idsku=634824
"Pedigree Ração Para Cães Adultos Carne E Vegetais 10,1kg",Cobasi,"R$ 167,90",https://www.cobasi.com.br/racao-pedigree-carne-e-vegetais-3798037/p?idsku=793442
"Ração Origens Cães Adultos Light Mini E Pequeno Frango E Cereais 10,1kg",Cobasi,"R$ 133,90",https://www.cobasi.com.br/racao-origens-light-caes-adultos-porte-mini-e-pequeno-frango-e-cereais-31004379/p?idsku=1004360
"Ração Vet Life Para Cães Hypoallergenic Mini - 10,1kg",Cobasi,"R$ 550,00",https://www.cobasi.com.br/racao-canine-vet-life-hypoallergenic-mini-natural-3814890/p?idsku=886661
"Ração Dog Chow Cães Filhotes Médios E Grandes Carne, Frango E Arroz 10,1kg",Cobasi,"R$ 153,99",https://www.cobasi.com.br/racao-dog-chow-filhote-frango-arroz-3820679/p?idsku=1127918
aw